{
  "$schema": "https://json-schema.org/draft/2020-12/schema",
  "type": "object",
  "additionalProperties": false,
  "required": ["artifact_class", "empirical", "scientific_status", "evidence_eligible", "expert_validated", "claim_ids", "identity", "implementation_status", "source_implementation_path", "source_implementation_raw_sha256", "inherited_rules", "sealed_targets_accessed", "model_output_accessed", "implementation_paths", "implementation_files"],
  "properties": {
    "artifact_class": {"const": "a0x-leg-implementation"},
    "empirical": {"const": true},
    "scientific_status": {"const": "exploratory"},
    "evidence_eligible": {"const": false},
    "expert_validated": {"const": false},
    "claim_ids": {"type": "array", "maxItems": 0},
    "identity": {"$ref": "#/$defs/identity"},
    "implementation_status": {"const": "frozen_before_model_output"},
    "source_implementation_path": {"$ref": "#/$defs/path"},
    "source_implementation_raw_sha256": {"$ref": "#/$defs/sha"},
    "inherited_rules": {"type": "object", "minProperties": 1},
    "sealed_targets_accessed": {"const": false},
    "model_output_accessed": {"const": false},
    "implementation_paths": {"type": "array", "minItems": 1, "uniqueItems": true, "items": {"$ref": "#/$defs/path"}},
    "implementation_files": {"type": "array", "minItems": 1, "items": {"type": "object", "additionalProperties": false, "required": ["path", "bytes", "sha256"], "properties": {"path": {"$ref": "#/$defs/path"}, "bytes": {"type": "integer", "minimum": 1}, "sha256": {"$ref": "#/$defs/sha"}}}}
  },
  "$defs": {
    "sha": {"type": "string", "pattern": "^[a-f0-9]{64}$"},
    "revision": {"type": "string", "pattern": "^[a-f0-9]{40}$"},
    "path": {"type": "string", "pattern": "^(?!/)(?!.*\\.\\.)[A-Za-z0-9._/-]+$"},
    "identity": {"type": "object", "additionalProperties": false, "required": ["leg", "protocol_id", "protected_tree_sha256", "selection_corpus_sha256", "source_base_commit"], "properties": {"leg": {"enum": ["a0", "r1"]}, "protocol_id": {"type": "string", "minLength": 1}, "protected_tree_sha256": {"$ref": "#/$defs/sha"}, "selection_corpus_sha256": {"$ref": "#/$defs/sha"}, "source_base_commit": {"$ref": "#/$defs/revision"}}}
  }
}
