{"artifact_class":"a0x-leg-implementation","claim_ids":[],"empirical":true,"evidence_eligible":false,"expert_validated":false,"identity":{"leg":"a0","protected_tree_sha256":"334a24453b3f7449300df25174737ac92fdfd2914f72d7c83550685c8d7524bd","protocol_id":"a0x-a0-six-model-v1","selection_corpus_sha256":"cf762fdb8e19c5d047910f1f65b353df06f31096cea27adf504ae8e0bccbf295","source_base_commit":"188eb65b5e249923baddadeba52659f07fcd1609"},"implementation_files":[{"bytes":293,"path":".github/a0x-hosted-gate-a-actions.json","sha256":"f84777250a50082cd4f2390d949193c73d983475d32c08b02536fdf5ebd8a7fd"},{"bytes":672,"path":".github/a0x-hosted-gate-a-lanes.json","sha256":"06a3c748ae9491ed4cfbf53f5f8eecdd23ab4ac2a9f7ca465b57874b838aa236"},{"bytes":11419,"path":".github/workflows/a0x-hosted-gate-a.yml","sha256":"5f74199107481c73adc2fa1efbd462c2a9d8b1d5009164892a2917d02ae595e4"},{"bytes":37420,"path":"Makefile","sha256":"7ae4f426a812e78ed857715c255ec753e09e2c1fe1eb52c34b2c6cac42e9e58d"},{"bytes":33,"path":"requirements-schema.in","sha256":"37caf5bff910fbd7dda44433b92df25fbfd989aea829e9bc4ce37e70df1f1782"},{"bytes":17541,"path":"requirements-schema.lock","sha256":"0bbafebbe4fdb6028f5e8565eae397d18d6ace90e7e5e2c5b9472aa924162be7"},{"bytes":14209,"path":"schemas/a0x-activation-receipt.schema.json","sha256":"aa3ff92fa99b0b0751b3f593ee7508c95c8e303959ee2bf4bd60a8ea37fe021d"},{"bytes":11003,"path":"schemas/a0x-activation-stage-occupancy-receipt.schema.json","sha256":"9c28a3de10858334d4d6f6c24bad0a8b3dbf8eef24f69fa0649356500d52b0bb"},{"bytes":7263,"path":"schemas/a0x-attempt-claim.schema.json","sha256":"c1ab65c1741876a933d22afb34399f85ca7df43a3bcfbcdae9b2e6bab7cb2bd8"},{"bytes":7384,"path":"schemas/a0x-authorization-dossier.schema.json","sha256":"1d72b6591ec406205edb988be223f7d2f17b8b0bd65445b9e57b555a93dc173c"},{"bytes":10237,"path":"schemas/a0x-ccp-observation.schema.json","sha256":"44c01339703d4931dc7b9eb0f5d885bbe131def16ca2c934764418cc2f6198eb"},{"bytes":18663,"path":"schemas/a0x-execution-authorization-v3.schema.json","sha256":"e9f5661b845871094bbb7350df3e86f061adcafc64d9e1a17877d2c87a588ee8"},{"bytes":16482,"path":"schemas/a0x-execution-authorization.schema.json","sha256":"68b5bdf10f8e46abffcc368e458853016630e2c5924f09786ec8b5ae47a8ee5e"},{"bytes":9592,"path":"schemas/a0x-external-assets-locator.schema.json","sha256":"f03d4384e26d02556190644311578eb2da4bd6886a93d12f91b290f1484eb473"},{"bytes":10363,"path":"schemas/a0x-gate-b-authorization.schema.json","sha256":"bc0f52d81a0280a8a59423eb4ab54ed63b06e4753e72ea095e78616873554874"},{"bytes":6933,"path":"schemas/a0x-gh-2.97.0-verification-result.schema.json","sha256":"ae6b10ae31d9667a6a9c76ee219384d3c9bcb640d2098b006adc4be60be6f0d2"},{"bytes":3479,"path":"schemas/a0x-guard-launch.schema.json","sha256":"89620d854d38311600f8a6c18a0211dfd5da3eea86c382eb083dc34eb97ee49f"},{"bytes":1502,"path":"schemas/a0x-hosted-gate-a-capture-request.schema.json","sha256":"0be1da1e1eef94c78ed0cb87a84fcd3fcaf5e1da217c1da00dbecafedc26eb28"},{"bytes":1468,"path":"schemas/a0x-hosted-gate-a-capture-transport.schema.json","sha256":"69830d76c21ef6ce4e3ea2e8627c46e4ec35b3660f10cb90d6563fad0c2ed863"},{"bytes":3056,"path":"schemas/a0x-hosted-gate-a-evidence.schema.json","sha256":"6e62ec41ea33bbc3ccb36baa997d0a8e2220cfdd60c61114834dd27e7638e2c2"},{"bytes":2333,"path":"schemas/a0x-hosted-gate-a-lane-receipt.schema.json","sha256":"bff0dbde1e167f1a78cc6aed60c7b2bade8e20123adb63472c4ed3795b379543"},{"bytes":1427,"path":"schemas/a0x-hosted-gate-a-transport.schema.json","sha256":"c9b9da5e2f66b5eda13d0a536438cc8d4cf071d400ec799c4795db4565dc6007"},{"bytes":9987,"path":"schemas/a0x-hosted-gate-a-verification-receipt.schema.json","sha256":"bd735639a9b34fb231f0118be9dab40599b407a40a29c17f63f29f0e7c7e680e"},{"bytes":1044,"path":"schemas/a0x-hosted-gate-a-verifier-policy.schema.json","sha256":"dc746e9c1985ac17dc918c7837891510b2c18a6c81e06aaeb8de2660bb0999d1"},{"bytes":5230,"path":"schemas/a0x-material-execution-contract.schema.json","sha256":"63149bb2f6fb36f7d70ec238f72a5c4827d8e651d2e366415d5db002d1e38e67"},{"bytes":9923,"path":"schemas/a0x-model-identity-receipt.schema.json","sha256":"28d32493c4e57cae16d2883be7803be86642de60c23138507f7d3dc53a984b65"},{"bytes":12909,"path":"schemas/a0x-output-occupancy-receipt.schema.json","sha256":"c6982e3ec918d042c9c16168c610c55c066c7705e5369aa46104225abba5fd5e"},{"bytes":3043,"path":"schemas/a0x-pair-binding.fragment.json","sha256":"66acfe46458da4a7ccd4f1fa57e2c3e97d0610a5f497f0be6f42660c3d59cbea"},{"bytes":4955,"path":"schemas/a0x-pair-projections.json","sha256":"6a0169f307b66a5eea788316b216fbd9cb40761abd2ccb7b811fca223d85da66"},{"bytes":10544,"path":"schemas/a0x-preflight-receipt.schema.json","sha256":"ddd4eec19e746beac7cf73b044404e854a66515c3a8baa09c608d2f06ff8b99e"},{"bytes":14226,"path":"schemas/a0x-publication-manifest.schema.json","sha256":"5258fbf153961cc53caf72f68746984439b87b0d54e42eb9765a27dac1364eb5"},{"bytes":2610,"path":"schemas/a0x-qualification-authorization.schema.json","sha256":"8953626e9008c7677acaeb09c1ca872bdcbcd099d48a2bcf343c4bb615e1be18"},{"bytes":4691,"path":"schemas/a0x-qualification-evidence.schema.json","sha256":"325036d2602f569c1d4dfc9731d82d5fe469f281f6109e6ea8796600b1ce84be"},{"bytes":9933,"path":"schemas/a0x-representation-record.schema.json","sha256":"cd9f5d12bd23c71945d245c7843d58605ba41fec8f7a5ad58d1c64a401c749e4"},{"bytes":30524,"path":"schemas/a0x-statistical-result.schema.json","sha256":"f0ba551507b6d13d2180033bef3b344e6ee9b9552fac70d26fc6e7d53e42ffb7"},{"bytes":11936,"path":"schemas/a0x-target-read-receipt.schema.json","sha256":"42da40c230d3fced6fde8085f391c7a19ea7df62027ad0cce420647df1f1e7a3"},{"bytes":39271,"path":"schemas/a0x-terminal-result.schema.json","sha256":"95ccdac5be8bf205f071642c46f6b4b089d0943f66f7596e0370961d9aa139a2"},{"bytes":7596,"path":"schemas/a0x-vertical-slice-manifest.schema.json","sha256":"c9e9dd0c7ce24fbae0af6cf0157860e936b426adef4a14805fd6924d92fba13a"},{"bytes":4496,"path":"scripts/a0x_build_gate_b_runtime.py","sha256":"b4dffcaf9c93e76e0f2d55577aa730d6828b2027a7ffa4ce0e3598f00f6bffca"},{"bytes":6852,"path":"scripts/a0x_capture_hosted_gate_a.py","sha256":"67cef25f9770326303f1476cdc892dfdf6b499ff54d32dcb318fb4fe9dc37a50"},{"bytes":1403,"path":"scripts/a0x_compatibility_check.py","sha256":"c89dc10de43b6b0a341963effa7e5eb854888a38be74b33f74c8aefed51e8b2e"},{"bytes":8601,"path":"scripts/a0x_compile_pair_schemas.py","sha256":"95221748b5b16d01ba11b0f3dfc0ed023c8f30d01df06eb454ff0a6eb7793dae"},{"bytes":982,"path":"scripts/a0x_contract_check.py","sha256":"a5fb96db4607b52d38ff9feb017f0e37d5c325e6cf133bc2a2c52880ad911b2f"},{"bytes":2928,"path":"scripts/a0x_hosted_gate_a.py","sha256":"5c6d8673f6e4a0d3314c682c2d1417f4c1c789e7ce83af256ac1ebd4b8cf624b"},{"bytes":1378,"path":"scripts/a0x_material.py","sha256":"effbed080b734311c962a2940c00c01ab9a5721f7fe1a7d9da4e6fc64be6f000"},{"bytes":23802,"path":"scripts/a0x_material_child.py","sha256":"fe49ad2e281f89645dc9deb1695131756f6e54dbcd9c81bc78525861421e0d30"},{"bytes":8116,"path":"scripts/a0x_materialize_no_model_receipt.py","sha256":"e779d001f44e244cdb66c82013a03a30580d4e9ca3ea50841e6955a2a3d68389"},{"bytes":6621,"path":"scripts/a0x_prepare_runtime.py","sha256":"22d81ae8b47edc883374eb948d6637f4cf88f5a1f5eb2512489680b59198d816"},{"bytes":3348,"path":"scripts/a0x_verify_hosted_gate_a.py","sha256":"4d3d764a2224c3777aeb3ea5875aa03d151fa15742af93d1cee6058b92b9a49b"},{"bytes":1782,"path":"scripts/a0x_vertical_material.py","sha256":"488097363e95881d51d368fb28b5cfd093c4f0c1853c1167fea60fa8aa3caba1"},{"bytes":43032,"path":"scripts/repository_check.py","sha256":"4c94ce76452c86499ab860e0cbbc4c576caee0294df73cbfe7c2c0513d6bb498"},{"bytes":24871,"path":"src/latent_triz/a0x_a0_activations.py","sha256":"70e70b0a1ba12331e2242fcfcdf8e354972e1fd23a7b0b1f1bb3eb4e1cd93b5a"},{"bytes":22749,"path":"src/latent_triz/a0x_a0_analysis.py","sha256":"2faf8552aabc14e2cf757bc54938c60cda9fa4368e9618c1907a03f9b20b7f93"},{"bytes":7361,"path":"src/latent_triz/a0x_apfs.py","sha256":"6e862c4b0d88a1450c86551d1309726e55fd16f7ef4f073b30146125ca566158"},{"bytes":64804,"path":"src/latent_triz/a0x_ccp_executor.py","sha256":"a13ee843413e866bf66607051b4cd9672023787be1371f9d9c1758298399f65e"},{"bytes":7989,"path":"src/latent_triz/a0x_compatibility.py","sha256":"1c239ad09cc3e1999fe7950659232b6da8521d67bb828d5a584b6f4d2b0e1549"},{"bytes":23953,"path":"src/latent_triz/a0x_contract.py","sha256":"f068cd8a311fb5d8a8eb81a5c42c5eeffc4c3b2117ff0592613456bec2357094"},{"bytes":34486,"path":"src/latent_triz/a0x_execution.py","sha256":"8c7f52a69a41e0f8a9e946b0d023c4caa620420fef9bb7e9daa28d4454205b6f"},{"bytes":48812,"path":"src/latent_triz/a0x_freeze.py","sha256":"c744ba0a1bc1eda4245c7b15665b1e860c76e021ed714a4fa9ab4c992101b454"},{"bytes":47086,"path":"src/latent_triz/a0x_gate_b_builder.py","sha256":"260e43a767dbc2e3f6a458d72cce81f1fa2385e2c73640f069680bfced552142"},{"bytes":8549,"path":"src/latent_triz/a0x_gate_contract.py","sha256":"d75d0862413e56fc37bd778b0becad49bf869734eb01d8b727a000f69118432f"},{"bytes":21620,"path":"src/latent_triz/a0x_hosted_capture.py","sha256":"32e40b01360f80c5c95076c3775ab441f298f81150cc50f4696b72b68fd82424"},{"bytes":11866,"path":"src/latent_triz/a0x_hosted_gate_a.py","sha256":"e18dc826f46145dfd122ea96611cc790833a823c84d1609f82004c6a231006ae"},{"bytes":24685,"path":"src/latent_triz/a0x_hosted_verifier.py","sha256":"fbb23c631250e5003fb90abdc39d486ae3ea232b4266d1120321ff60f8d512e9"},{"bytes":22227,"path":"src/latent_triz/a0x_material_contract.py","sha256":"687430c80dfce9abf27dceef45b7a8a399c1ab2b85e9c3d4aba26582d1066576"},{"bytes":22254,"path":"src/latent_triz/a0x_material_runtime.py","sha256":"36c7c235302f2daf492ac68a620d3d5b70996ea91538021ec730cc4c5c91870b"},{"bytes":14137,"path":"src/latent_triz/a0x_model_adapter.py","sha256":"efb1f64fd983202eb368e970a44e233e3f208b2ad35b8f442b0193b05063cbd6"},{"bytes":11618,"path":"src/latent_triz/a0x_pair.py","sha256":"82f1ecbfdf6f30cc5b19a311ab1cd67c1a0592ffaf27651d4bda5719f097fe19"},{"by